{
  "name": "root_request_4",
  "method": "POST",
  "address": "http://jsonplaceholder.typicode.com/posts",
  "headers": {
    "Content-type": "application/json; charset=UTF-8"
  },
  "body": {
    "title": "${hello}",
    "body": "sendie",
    "userId": 1,
    "yes": {
      "world": "yes"
    }
  }
}
